CREATE EXTENSION blackhole_am;
CREATE TABLE blackhole_tab (a int) USING blackhole_am;
NOTICE:  calling function blackhole_am_handler
NOTICE:  calling function blackhole_relation_set_new_filelocator
NOTICE:  calling function blackhole_am_handler
NOTICE:  calling function blackhole_relation_needs_toast_table
SELECT * FROM blackhole_tab;
NOTICE:  calling function blackhole_am_handler
LINE 1: SELECT * FROM blackhole_tab;
                      ^
NOTICE:  calling function blackhole_estimate_rel_size
NOTICE:  calling function blackhole_slot_callbacks
NOTICE:  calling function blackhole_scan_begin
NOTICE:  calling function blackhole_scan_getnextslot
NOTICE:  calling function blackhole_scan_end
 a 
---
(0 rows)

INSERT INTO blackhole_tab VALUES (1);
NOTICE:  calling function blackhole_slot_callbacks
NOTICE:  calling function blackhole_tuple_insert
SELECT * FROM blackhole_tab;
NOTICE:  calling function blackhole_estimate_rel_size
NOTICE:  calling function blackhole_slot_callbacks
NOTICE:  calling function blackhole_scan_begin
NOTICE:  calling function blackhole_scan_getnextslot
NOTICE:  calling function blackhole_scan_end
 a 
---
(0 rows)

UPDATE blackhole_tab SET a = 0 WHERE a = 1;
NOTICE:  calling function blackhole_estimate_rel_size
NOTICE:  calling function blackhole_slot_callbacks
NOTICE:  calling function blackhole_scan_begin
NOTICE:  calling function blackhole_scan_getnextslot
NOTICE:  calling function blackhole_scan_end
SELECT * FROM blackhole_tab;
NOTICE:  calling function blackhole_estimate_rel_size
NOTICE:  calling function blackhole_slot_callbacks
NOTICE:  calling function blackhole_scan_begin
NOTICE:  calling function blackhole_scan_getnextslot
NOTICE:  calling function blackhole_scan_end
 a 
---
(0 rows)

DELETE FROM blackhole_tab WHERE a = 1;
NOTICE:  calling function blackhole_estimate_rel_size
NOTICE:  calling function blackhole_slot_callbacks
NOTICE:  calling function blackhole_scan_begin
NOTICE:  calling function blackhole_scan_getnextslot
NOTICE:  calling function blackhole_scan_end
SELECT * FROM blackhole_tab;
NOTICE:  calling function blackhole_estimate_rel_size
NOTICE:  calling function blackhole_slot_callbacks
NOTICE:  calling function blackhole_scan_begin
NOTICE:  calling function blackhole_scan_getnextslot
NOTICE:  calling function blackhole_scan_end
 a 
---
(0 rows)

-- ALTER TABLE SET ACCESS METHOD
ALTER TABLE blackhole_tab SET ACCESS METHOD heap;
NOTICE:  calling function blackhole_relation_needs_toast_table
NOTICE:  calling function blackhole_slot_callbacks
NOTICE:  calling function blackhole_scan_begin
NOTICE:  calling function blackhole_scan_getnextslot
NOTICE:  calling function blackhole_scan_end
NOTICE:  calling function blackhole_am_handler
INSERT INTO blackhole_tab VALUES (1);
SELECT * FROM blackhole_tab;
 a 
---
 1
(1 row)

ALTER TABLE blackhole_tab SET ACCESS METHOD blackhole_am;
NOTICE:  calling function blackhole_am_handler
NOTICE:  calling function blackhole_relation_set_new_filelocator
NOTICE:  calling function blackhole_am_handler
NOTICE:  calling function blackhole_slot_callbacks
NOTICE:  calling function blackhole_tuple_insert
NOTICE:  calling function blackhole_finish_bulk_insert
NOTICE:  calling function blackhole_am_handler
SELECT * FROM blackhole_tab;
NOTICE:  calling function blackhole_am_handler
LINE 1: SELECT * FROM blackhole_tab;
                      ^
NOTICE:  calling function blackhole_estimate_rel_size
NOTICE:  calling function blackhole_slot_callbacks
NOTICE:  calling function blackhole_scan_begin
NOTICE:  calling function blackhole_scan_getnextslot
NOTICE:  calling function blackhole_scan_end
 a 
---
(0 rows)

-- Clean up
DROP TABLE blackhole_tab;
